{
  "$id": "https://sce.crocoder.dev/v0.4.0-pre-alpha-v11/config.json",
  "$schema": "https://json-schema.org/draft/2020-12/schema",
  "title": "SCE Config",
  "description": "Canonical JSON Schema for global and repo-local sce/config.json files.",
  "type": "object",
  "properties": {
    "$schema": {
      "type": "string",
      "const": "https://sce.crocoder.dev/v0.4.0-pre-alpha-v11/config.json"
    },
    "log_level": {
      "description": "Minimum severity of log records.",
      "default": "error",
      "type": "string",
      "enum": [
        "error",
        "warn",
        "info",
        "debug"
      ]
    },
    "log_format": {
      "description": "Format used for log records.",
      "default": "text",
      "type": "string",
      "enum": [
        "text",
        "json"
      ]
    },
    "log_to_file": {
      "description": "Write log records to the configured log directory.",
      "default": true,
      "type": "boolean"
    },
    "log_dir": {
      "description": "Directory for log files when file logging is enabled.",
      "default": "<state_root>/sce/logs",
      "type": "string",
      "minLength": 1
    },
    "log_file_retention_limit": {
      "description": "Maximum number of log files retained.",
      "default": 10,
      "type": "integer",
      "minimum": 1
    },
    "workos_client_id": {
      "description": "WorkOS client ID used for authentication.",
      "type": "string"
    },
    "control_plane_base_url": {
      "description": "Base URL of the control-plane Agent Trace ingestion API used by `sce trace sync`.",
      "type": "string",
      "minLength": 1
    },
    "agent_trace": {
      "description": "Agent Trace repository identity configuration. Selects the repository-scoped Agent Trace database.",
      "type": "object",
      "properties": {
        "repository_id": {
          "description": "Explicit repository identity. When set, overrides Git remote based repository identity resolution.",
          "type": "string",
          "minLength": 1
        },
        "repository_remote": {
          "description": "Git remote name used to derive repository identity.",
          "default": "origin",
          "type": "string",
          "minLength": 1
        },
        "auto_sync": {
          "description": "Launch a detached, best-effort `sce sync` after successful post-commit Agent Trace persistence.",
          "default": true,
          "type": "boolean"
        }
      },
      "additionalProperties": false
    },
    "otel": {
      "description": "Optional managed OpenTelemetry declaration. Omitting the block or any field keeps the code-owned managed defaults; managed export never lets this block redirect authenticated requests.",
      "type": "object",
      "properties": {
        "endpoint": {
          "description": "Managed OTLP collector base URL.",
          "default": "https://otel.crocoderlab.dev",
          "type": "string",
          "minLength": 1
        },
        "protocol": {
          "description": "OTLP transport protocol.",
          "default": "http/protobuf",
          "type": "string",
          "enum": [
            "http/protobuf"
          ]
        },
        "traces_endpoint": {
          "description": "OTLP traces endpoint.",
          "default": "https://otel.crocoderlab.dev/v1/traces",
          "type": "string",
          "minLength": 1
        },
        "metrics_endpoint": {
          "description": "Reserved OTLP metrics endpoint for the later metrics pipeline.",
          "default": "https://otel.crocoderlab.dev/v1/metrics",
          "type": "string",
          "minLength": 1
        },
        "logs_endpoint": {
          "description": "OTLP logs endpoint.",
          "default": "https://otel.crocoderlab.dev/v1/logs",
          "type": "string",
          "minLength": 1
        }
      },
      "additionalProperties": false
    },
    "policies": {
      "description": "Policy configuration for SCE runtime and bash-tool enforcement.",
      "type": "object",
      "properties": {
        "attribution_hooks": {
          "description": "Policy for commit-msg attribution hooks.",
          "type": "object",
          "properties": {
            "enabled": {
              "description": "Enable SCE attribution hooks.",
              "default": true,
              "type": "boolean"
            }
          },
          "additionalProperties": false
        },
        "database_retry": {
          "description": "Per-database retry policy overrides for local, Agent Trace, and auth databases.",
          "type": "object",
          "properties": {
            "local_db": {
              "description": "Retry policy overrides for a database's connection and query operations.",
              "type": "object",
              "properties": {
                "connection_open": {
                  "description": "Retry timing and attempt limits for one database operation.",
                  "type": "object",
                  "properties": {
                    "max_attempts": {
                      "description": "Maximum number of attempts for the operation.",
                      "type": "integer",
                      "minimum": 1
                    },
                    "timeout_ms": {
                      "description": "Timeout in milliseconds for each attempt.",
                      "type": "integer",
                      "minimum": 1
                    },
                    "initial_backoff_ms": {
                      "description": "Initial retry backoff in milliseconds.",
                      "type": "integer",
                      "minimum": 0
                    },
                    "max_backoff_ms": {
                      "description": "Maximum retry backoff in milliseconds.",
                      "type": "integer",
                      "minimum": 0
                    }
                  },
                  "additionalProperties": false,
                  "required": [
                    "max_attempts",
                    "timeout_ms",
                    "initial_backoff_ms",
                    "max_backoff_ms"
                  ]
                },
                "query": {
                  "description": "Retry timing and attempt limits for one database operation.",
                  "type": "object",
                  "properties": {
                    "max_attempts": {
                      "description": "Maximum number of attempts for the operation.",
                      "type": "integer",
                      "minimum": 1
                    },
                    "timeout_ms": {
                      "description": "Timeout in milliseconds for each attempt.",
                      "type": "integer",
                      "minimum": 1
                    },
                    "initial_backoff_ms": {
                      "description": "Initial retry backoff in milliseconds.",
                      "type": "integer",
                      "minimum": 0
                    },
                    "max_backoff_ms": {
                      "description": "Maximum retry backoff in milliseconds.",
                      "type": "integer",
                      "minimum": 0
                    }
                  },
                  "additionalProperties": false,
                  "required": [
                    "max_attempts",
                    "timeout_ms",
                    "initial_backoff_ms",
                    "max_backoff_ms"
                  ]
                }
              },
              "additionalProperties": false
            },
            "agent_trace_db": {
              "description": "Retry policy overrides and write-contention settings for the Agent Trace database.",
              "type": "object",
              "properties": {
                "connection_open": {
                  "description": "Retry timing and attempt limits for one database operation.",
                  "type": "object",
                  "properties": {
                    "max_attempts": {
                      "description": "Maximum number of attempts for the operation.",
                      "type": "integer",
                      "minimum": 1
                    },
                    "timeout_ms": {
                      "description": "Timeout in milliseconds for each attempt.",
                      "type": "integer",
                      "minimum": 1
                    },
                    "initial_backoff_ms": {
                      "description": "Initial retry backoff in milliseconds.",
                      "type": "integer",
                      "minimum": 0
                    },
                    "max_backoff_ms": {
                      "description": "Maximum retry backoff in milliseconds.",
                      "type": "integer",
                      "minimum": 0
                    }
                  },
                  "additionalProperties": false,
                  "required": [
                    "max_attempts",
                    "timeout_ms",
                    "initial_backoff_ms",
                    "max_backoff_ms"
                  ]
                },
                "query": {
                  "description": "Retry timing and attempt limits for one database operation.",
                  "type": "object",
                  "properties": {
                    "max_attempts": {
                      "description": "Maximum number of attempts for the operation.",
                      "type": "integer",
                      "minimum": 1
                    },
                    "timeout_ms": {
                      "description": "Timeout in milliseconds for each attempt.",
                      "type": "integer",
                      "minimum": 1
                    },
                    "initial_backoff_ms": {
                      "description": "Initial retry backoff in milliseconds.",
                      "type": "integer",
                      "minimum": 0
                    },
                    "max_backoff_ms": {
                      "description": "Maximum retry backoff in milliseconds.",
                      "type": "integer",
                      "minimum": 0
                    }
                  },
                  "additionalProperties": false,
                  "required": [
                    "max_attempts",
                    "timeout_ms",
                    "initial_backoff_ms",
                    "max_backoff_ms"
                  ]
                },
                "busy_timeout_ms": {
                  "description": "Turso busy timeout in milliseconds applied to every Agent Trace database connection. 0 disables the busy handler.",
                  "default": 1000,
                  "type": "integer",
                  "minimum": 0,
                  "maximum": 10000
                },
                "contention_deadline_ms": {
                  "description": "Deadline in milliseconds after which no further Agent Trace write-contention retry is started. It schedules retries and does not interrupt a running operation. 0 starts no outer retry.",
                  "default": 2250,
                  "type": "integer",
                  "minimum": 0,
                  "maximum": 30000
                }
              },
              "additionalProperties": false
            },
            "auth_db": {
              "description": "Retry policy overrides for a database's connection and query operations.",
              "type": "object",
              "properties": {
                "connection_open": {
                  "description": "Retry timing and attempt limits for one database operation.",
                  "type": "object",
                  "properties": {
                    "max_attempts": {
                      "description": "Maximum number of attempts for the operation.",
                      "type": "integer",
                      "minimum": 1
                    },
                    "timeout_ms": {
                      "description": "Timeout in milliseconds for each attempt.",
                      "type": "integer",
                      "minimum": 1
                    },
                    "initial_backoff_ms": {
                      "description": "Initial retry backoff in milliseconds.",
                      "type": "integer",
                      "minimum": 0
                    },
                    "max_backoff_ms": {
                      "description": "Maximum retry backoff in milliseconds.",
                      "type": "integer",
                      "minimum": 0
                    }
                  },
                  "additionalProperties": false,
                  "required": [
                    "max_attempts",
                    "timeout_ms",
                    "initial_backoff_ms",
                    "max_backoff_ms"
                  ]
                },
                "query": {
                  "description": "Retry timing and attempt limits for one database operation.",
                  "type": "object",
                  "properties": {
                    "max_attempts": {
                      "description": "Maximum number of attempts for the operation.",
                      "type": "integer",
                      "minimum": 1
                    },
                    "timeout_ms": {
                      "description": "Timeout in milliseconds for each attempt.",
                      "type": "integer",
                      "minimum": 1
                    },
                    "initial_backoff_ms": {
                      "description": "Initial retry backoff in milliseconds.",
                      "type": "integer",
                      "minimum": 0
                    },
                    "max_backoff_ms": {
                      "description": "Maximum retry backoff in milliseconds.",
                      "type": "integer",
                      "minimum": 0
                    }
                  },
                  "additionalProperties": false,
                  "required": [
                    "max_attempts",
                    "timeout_ms",
                    "initial_backoff_ms",
                    "max_backoff_ms"
                  ]
                }
              },
              "additionalProperties": false
            }
          },
          "additionalProperties": false
        },
        "bash": {
          "description": "Bash-tool command blocking policy configuration.",
          "type": "object",
          "properties": {
            "presets": {
              "description": "Built-in bash-tool policy preset IDs to enable.",
              "type": "array",
              "items": {
                "type": "string",
                "enum": [
                  "forbid-git-all",
                  "forbid-git-commit",
                  "use-pnpm-over-npm",
                  "use-bun-over-npm",
                  "use-nix-flake-over-cargo"
                ]
              },
              "uniqueItems": true,
              "allOf": [
                {
                  "not": {
                    "allOf": [
                      {
                        "contains": {
                          "const": "use-pnpm-over-npm"
                        }
                      },
                      {
                        "contains": {
                          "const": "use-bun-over-npm"
                        }
                      }
                    ]
                  }
                }
              ]
            },
            "custom": {
              "description": "Repository-defined bash-tool policies with custom matching and messages.",
              "type": "array",
              "items": {
                "type": "object",
                "properties": {
                  "id": {
                    "description": "Unique identifier for the custom bash policy.",
                    "type": "string",
                    "minLength": 1,
                    "not": {
                      "enum": [
                        "forbid-git-all",
                        "forbid-git-commit",
                        "use-pnpm-over-npm",
                        "use-bun-over-npm",
                        "use-nix-flake-over-cargo"
                      ]
                    }
                  },
                  "match": {
                    "description": "Command matching rule for the custom bash policy.",
                    "type": "object",
                    "properties": {
                      "argv_prefix": {
                        "description": "Leading command arguments that activate the policy.",
                        "type": "array",
                        "items": {
                          "type": "string",
                          "minLength": 1
                        },
                        "minItems": 1
                      }
                    },
                    "additionalProperties": false,
                    "required": [
                      "argv_prefix"
                    ]
                  },
                  "satisfied_by": {
                    "description": "Wrapper argv prefixes that already satisfy this policy. The policy does not fire when the matched command was unwrapped from one of these wrappers, so a policy steering `rg` toward nix can stay quiet for `nix shell nixpkgs#ripgrep -c rg ...` while still blocking a bare `rg`.",
                    "type": "array",
                    "items": {
                      "type": "array",
                      "items": {
                        "type": "string",
                        "minLength": 1
                      },
                      "minItems": 1
                    }
                  },
                  "message": {
                    "description": "User-facing message shown when the policy blocks a command.",
                    "type": "string",
                    "minLength": 1
                  }
                },
                "additionalProperties": false,
                "required": [
                  "id",
                  "match",
                  "message"
                ]
              }
            }
          },
          "additionalProperties": false
        }
      },
      "additionalProperties": false
    },
    "integrations": {
      "description": "Integration targets and optional workflows selected for SCE setup.",
      "type": "object",
      "properties": {
        "target": {
          "description": "Integration targets into which SCE assets are installed.",
          "type": "array",
          "items": {
            "type": "string",
            "enum": [
              "opencode",
              "claude",
              "pi",
              "codex"
            ]
          },
          "uniqueItems": true
        },
        "optional_workflows": {
          "description": "Optional workflows selected for installation into the configured integration targets. Only workflows marked optional in the canonical workflow catalog participate; core workflows are always installed.",
          "type": "array",
          "items": {
            "type": "string",
            "enum": [
              "brownfield"
            ]
          },
          "uniqueItems": true
        }
      },
      "additionalProperties": false
    }
  },
  "additionalProperties": false
}
