{
  "$schema": "https://sce.crocoder.dev/v0.4.0-pre-alpha-v11/config.json",
  "agent_trace": {
    "auto_sync": true
  },
  "integrations": {
    "optional_workflows": [],
    "target": [
      "opencode",
      "claude",
      "pi",
      "codex"
    ]
  },
  "log_dir": "context/tmp",
  "log_level": "error",
  "policies": {
    "attribution_hooks": {
      "enabled": true
    },
    "bash": {
      "custom": [
        {
          "id": "use-nix-flake-check-over-cargo-test",
          "match": {
            "argv_prefix": [
              "cargo",
              "test"
            ]
          },
          "message": "This repository prefers `nix flake check` over direct `cargo test` commands. Run `nix flake check` instead."
        },
        {
          "id": "use-nix-flake-check-over-cargo-fmt-check",
          "match": {
            "argv_prefix": [
              "cargo",
              "fmt",
              "--check"
            ]
          },
          "message": "This repository prefers `nix flake check` over direct `cargo fmt --check`. Run `nix flake check` for verification; keep `cargo fmt` for autofix-only formatting."
        },
        {
          "id": "use-nix-flake-check-over-cargo-check",
          "match": {
            "argv_prefix": [
              "cargo",
              "check"
            ]
          },
          "message": "This repository prefers `nix flake check` over direct `cargo check`. Run `nix flake check` instead."
        },
        {
          "id": "use-nix-for-ripgrep",
          "match": {
            "argv_prefix": [
              "rg"
            ]
          },
          "message": "Run `rg` through nix: `nix run nixpkgs#ripgrep -- <args>`.",
          "satisfied_by": [
            [
              "nix",
              "shell",
              "nixpkgs#ripgrep"
            ]
          ]
        },
        {
          "id": "use-nix-for-jq",
          "match": {
            "argv_prefix": [
              "jq"
            ]
          },
          "message": "Run `jq` through nix: `nix run nixpkgs#jq -- <args>`.",
          "satisfied_by": [
            [
              "nix",
              "shell",
              "nixpkgs#jq"
            ]
          ]
        },
        {
          "id": "use-nix-for-python3",
          "match": {
            "argv_prefix": [
              "python3"
            ]
          },
          "message": "Run `python3` through nix: `nix run nixpkgs#python3 -- <args>`.",
          "satisfied_by": [
            [
              "nix",
              "shell",
              "nixpkgs#python3"
            ]
          ]
        },
        {
          "id": "use-nix-for-node",
          "match": {
            "argv_prefix": [
              "node"
            ]
          },
          "message": "Run `node` through nix: `nix run nixpkgs#nodejs -- <args>`.",
          "satisfied_by": [
            [
              "nix",
              "shell",
              "nixpkgs#nodejs"
            ]
          ]
        },
        {
          "id": "use-nix-for-bun",
          "match": {
            "argv_prefix": [
              "bun"
            ]
          },
          "message": "Run `bun` through nix: `nix run nixpkgs#bun -- <args>`.",
          "satisfied_by": [
            [
              "nix",
              "shell",
              "nixpkgs#bun"
            ]
          ]
        },
        {
          "id": "use-nix-for-fd",
          "match": {
            "argv_prefix": [
              "fd"
            ]
          },
          "message": "Run `fd` through nix: `nix run nixpkgs#fd -- <args>`.",
          "satisfied_by": [
            [
              "nix",
              "shell",
              "nixpkgs#fd"
            ]
          ]
        },
        {
          "id": "use-nix-for-shellcheck",
          "match": {
            "argv_prefix": [
              "shellcheck"
            ]
          },
          "message": "Run `shellcheck` through nix: `nix run nixpkgs#shellcheck -- <args>`.",
          "satisfied_by": [
            [
              "nix",
              "shell",
              "nixpkgs#shellcheck"
            ]
          ]
        },
        {
          "id": "use-nix-for-actionlint",
          "match": {
            "argv_prefix": [
              "actionlint"
            ]
          },
          "message": "Run `actionlint` through nix: `nix run nixpkgs#actionlint -- <args>`.",
          "satisfied_by": [
            [
              "nix",
              "shell",
              "nixpkgs#actionlint"
            ]
          ]
        },
        {
          "id": "use-nix-for-yq",
          "match": {
            "argv_prefix": [
              "yq"
            ]
          },
          "message": "Run `yq` through nix: `nix run nixpkgs#yq-go -- <args>`.",
          "satisfied_by": [
            [
              "nix",
              "shell",
              "nixpkgs#yq-go"
            ]
          ]
        },
        {
          "id": "use-nix-for-hyperfine",
          "match": {
            "argv_prefix": [
              "hyperfine"
            ]
          },
          "message": "Run `hyperfine` through nix: `nix run nixpkgs#hyperfine -- <args>`.",
          "satisfied_by": [
            [
              "nix",
              "shell",
              "nixpkgs#hyperfine"
            ]
          ]
        }
      ],
      "presets": []
    }
  }
}
